{
  "id": "rdd-receipt-010",
  "freeze": "HEAD-7544655c-fa1ef5ba",
  "freeze_note": "Slice R9-S2 ci(contracts): job contracts en CI + badge README en rama experimento/mejora-ronda9-contratos-ci. Base HEAD 7544655c (S1b drift-fix PASS 166/166); diff8=fa1ef5ba = git diff tracked al emitir (ci.yml +16, README +2). lines_changed=18 solo scope plan §3 (numstat tracked); fuera del conteo: odd/tasks/ronda9-contratos-ci.md 200L untracked Fase 1 incluido en este commit + este receipt (~30L). Commit total ~248L < 400L.",
  "tier": 2,
  "tier_justification": "RDD Risk Tiers: Tier 2 = pipeline compartido .github/workflows/ci.yml (afecta todos los PRs) + badge publico README. Superficie de decision: workflow destino, paths Pester, filtro badge.",
  "files": [".github/workflows/ci.yml", "README.md"],
  "lines_changed": 18,
  "lines_deleted": 0,
  "verdict": "PASS",
  "verdict_note": "python yaml.safe_load ci.yml PASS + pre-commit check-yaml NO ejecutable (env virtualenv distlib.util ausente, honesto pendiente) + actionlint no instalado (pendiente honesto) + Pester comando exacto del job local 166/166 0 FAIL (contract-* 5 files incl. manifest S1 + golden-prompts + golden-fixtures) + job contracts remoto pendiente (sin push por constraints) + badge shields job=contracts bajo linea 1 README.",
  "review": {
    "status": "PASS 4R BLOCKER-capable (0 BLOCKERs)",
    "method": "code-review-agent 4R BLOCKER-capable + Pester full-suite verde",
    "gaps": []
  },
  "escalation": "judgment-day no requerido (PASS directo, 0 BLOCKERs)",
  "blockers": [],
  "next": ["Ronda 10 (seccion 9)"],
  "auto_fix": false,
  "timestamp": "2026-09-24T15:13:01.4719552-06:00"
}
