{
  "id": "rdd-receipt-011",
  "freeze": "HEAD-cd7c4c2-e69de29b",
  "freeze_note": "Slice R10-S1 docs(skills): fix referencia rota optimize-system.ps1 en rama experimento/mejora-ronda10-recursos (base cd7c4c2527d3df95f38880593c189022326525fe). diff8=e69de29b = git diff vacio al iniciar el slice (plan untracked no cuenta en diff). lines_changed=13 solo scope (SKILL.md 3/3 + reference.md 3/4); el commit ademas incluye odd/tasks/ronda10-recursos.md (fila Review Log R10-S1) + este receipt, ambos fuera del conteo (precedente rdd-receipt-007).",
  "tier": 1,
  "tier_justification": "RDD Risk Tiers: Tier 1 = solo docs/skills (SKILL.md + reference.md). Sin runtime, sin opencode.json, sin scripts nuevos. Autonomo.",
  "files": [".agents/skills/development-mode/SKILL.md", "docs/skills/development-mode/reference.md"],
  "lines_changed": 13,
  "lines_deleted": 7,
  "verdict": "PASS",
  "verdict_note": "Select-String optimize-system 0 hits en ambos archivos; scripts/optimize-system.ps1 sigue inexistente por diseno (enfoque A); cross-ref-check.ps1 OK ALL CHECKS PASSED; skill-frontmatter + contract-frontmatter 117/117 PASS.",
  "review": {"status": "PASS", "method": "inline 4R self-check (Risk/Readability/Reliability/Resilience) — sin reviewer agent separado en este run", "gaps": []},
  "blockers": [],
  "next": ["R10-S2 (OWNER)"],
  "auto_fix": false,
  "timestamp": "2026-09-24T15:52:05.9924850-06:00"
}
