{
  "id": "rdd-receipt-003",
  "freeze": "HEAD-e9151325-e69de29b",
  "freeze_note": "Freeze point = HEAD e9151325 (main, rama fix/pester-update-opencode-20260923 recien creada, arbol limpio salvo el fix). Receipt generado EN CALIENTE, antes del commit y del merge.",
  "tier": 1,
  "tier_justification": "RDD SKILL Risk Tiers: Tier 1 = cambio pequeno sin auth/schema/API/deps. Este slice: solo scripts/tests/update-opencode.Tests.ps1 (+22/-7) + 1 linea en .gentleman/write-scope.json (allowlist .rdd/*). No toca el script bajo test, ni workflows, ni auth, ni schema, ni API, ni dependencias.",
  "files": [
    "scripts/tests/update-opencode.Tests.ps1",
    ".gentleman/write-scope.json"
  ],
  "file_statuses": {
    "deleted": [],
    "modified": [
      "scripts/tests/update-opencode.Tests.ps1",
      ".gentleman/write-scope.json"
    ]
  },
  "lines_changed": 23,
  "lines_deleted": 7,
  "verdict": "PASS",
  "verdict_note": "Self-review 4R (single review, tier 1) con veredicto PASS. Sin fixes adicionales, sin blockers.",
  "review": {
    "status": "PASS",
    "method": "self 4R (single review, tier 1): el test hermetico ahora aprovisiona su propio binario sano (copia de node.exe + fake npm.cmd), espejando el patron ya probado en CI del corrupt-binary test del mismo archivo",
    "duration_ms": null,
    "gate_output": "PASS",
    "process_breach": false,
    "gaps": []
  },
  "4r": {
    "run": true,
    "Risk": 9,
    "Readability": 9,
    "Reliability": 9,
    "Resilience": 8,
    "score": 8.8,
    "method": "self 4R (single review, tier 1)"
  },
  "fixes_applied": 0,
  "blockers": [],
  "process_blockers": [],
  "escalation": "none",
  "next": [
    "Verificar CI de GitHub (pester-tests: update-opencode.Tests.ps1:37 en verde)",
    "Slice 2 separado: resource-optimization.Tests.ps1:29 (NO tocado en este slice)"
  ],
  "auto_fix": false,
  "retroactive": false,
  "retroactive_note": "Receipt EN CALIENTE, redactado antes del commit — mismo dia del fix.",
  "notes": "Causa raiz (CI run 35908572266, log --log-failed): el job `tests` en windows-latest NUNCA instala opencode-ai, entonces Test-Binary devuelve $null, el heal corre node contra un postinstall.mjs inexistente, verify falla y status='fail' (Expected length 2 'ok'). El test se llamaba 'hermetico' pero dependia del binario global ambiental. Fix: binario sano falso autocontenido (copia de node.exe, que responde --version con semver) + fake npm.cmd que apunta al prefix temporal — mismo patron del corrupt-binary test, que SI pasa en CI. Repro local CI-fiel (binario global oculto): antes status=fail / despues 13/13 verde. Sin -Skip (cero skips agregados). Efecto colateral positivo: el test bajo de 8.7s a 2.7s (ya no toca el binario real ni duerme en reintentos). HALLAZGO DE PROCESO: .rdd/* no estaba en write-scope.json, por lo que el receipt NO podia commitearse sin --no-verify (el receipt-002 previo, 1d432300, solo toco .rdd/ y por ende tuvo que bypassear el gate). Se agrego '.rdd/*' al allowlist (1 linea, precedente: chore(scope) 917d6cd4 plugins/*, d3fdbe66 cmd/*) para que futuros receipts pasen por la puerta principal. Sin --no-verify en este slice.",
  "timestamp": "2026-09-23T13:40:00.0000000-06:00"
}
