{
  "id": "rdd-receipt-001",
  "freeze": "HEAD-8bd151a3-d93109fc",
  "freeze_note": "Freeze point = base 8bd151a3 (pre-batch). diff 8bd151a3..3eff2e8b hasheado con 'git diff | git hash-object --stdin' = d93109fc37b65fcdc472a7540d01a2675dbda52f (8 chars: d93109fc). Receipt generado post-ship: documentacion retroactiva honesta del lote.",
  "tier": 2,
  "tier_justification": "RDD SKILL Risk Tiers: Tier 2 = '>5 files OR >200L'. Este lote: 18 archivos (>5) y 274 insertions / 211 deletions (>200L). Ademas incluye scripts compartidos y eliminacion de suite de tests.",
  "files": [
    ".agents/skills/command-wrapper/SKILL.md",
    ".agents/skills/container-security/SKILL.md",
    ".agents/skills/engram-protocol/SKILL.md",
    ".agents/skills/odd/SKILL.md",
    ".agents/skills/ps-compat/SKILL.md",
    ".project.json",
    "README.md",
    "scripts/clean-worktree-temp.ps1",
    "scripts/gate-prep.ps1",
    "scripts/heap-snapshot.ps1",
    "scripts/switch-profile.ps1",
    "scripts/tests/engram-compact.Tests.ps1",
    "scripts/tests/generate-dashboard-data.Tests.ps1",
    "scripts/tests/run.Tests.ps1",
    "scripts/tests/switch-profile.Tests.ps1",
    "tests/collapsible-history.Tests.ps1",
    "tests/opencode-models.free-availability.Tests.ps1",
    "tests/validate-write-scope.Tests.ps1"
  ],
  "file_statuses": {
    "deleted": ["scripts/tests/run.Tests.ps1"],
    "modified": [
      ".agents/skills/command-wrapper/SKILL.md",
      ".agents/skills/container-security/SKILL.md",
      ".agents/skills/engram-protocol/SKILL.md",
      ".agents/skills/odd/SKILL.md",
      ".agents/skills/ps-compat/SKILL.md",
      ".project.json",
      "README.md",
      "scripts/clean-worktree-temp.ps1",
      "scripts/gate-prep.ps1",
      "scripts/heap-snapshot.ps1",
      "scripts/switch-profile.ps1",
      "scripts/tests/engram-compact.Tests.ps1",
      "scripts/tests/generate-dashboard-data.Tests.ps1",
      "scripts/tests/switch-profile.Tests.ps1",
      "tests/collapsible-history.Tests.ps1",
      "tests/opencode-models.free-availability.Tests.ps1",
      "tests/validate-write-scope.Tests.ps1"
    ]
  },
  "lines_changed": 274,
  "lines_deleted": 211,
  "verdict": "SKIP",
  "verdict_note": "4R NO ejecutado => no existe veredicto 4R. SKIP = review 4R omitido (brecha de proceso, RDD rule 4 tier 2). NO se declara PASS/APPROVED pleno. El unico check real fue fast-path VERIFY-OK.",
  "review": {
    "status": "VERIFY_OK_FASTPATH",
    "method": "jd-verifier.ps1 -Zone ROJA -FastPath",
    "duration_ms": 24,
    "gate_output": "VERIFY-OK",
    "process_breach": true,
    "gaps": [
      "4R BLOCKER-capable (code-review-agent) NO ejecutado — requerido por RDD rule 4 para tier 2",
      "Doble review ciega (judgment-day dual) NO ejecutada",
      "CI de GitHub pendiente/parcial al momento de generar este receipt (e2e/tests/tests-v1/pester-tests/security/pssa-lint)"
    ]
  },
  "4r": { "run": false, "risk": 0, "read": 0, "rel": 0, "res": 0 },
  "fixes_applied": 0,
  "blockers": [],
  "process_blockers": [
    "RDD rule 4 breach: tier 2 exige 4R BLOCKER-capable o escalacion a judgment-day en FAIL; solo se corrio fast-path VERIFY-OK (24 ms)"
  ],
  "escalation": "judgment-day",
  "next": [
    "Ejecutar 4R BLOCKER-capable (code-review-agent) sobre el diff 8bd151a3..3eff2e8b",
    "o judgment-day dual (2 code-review-agent de perfiles opuestos + sintesis de veredicto)",
    "Verificar CI de GitHub completo (e2e/tests/tests-v1/pester-tests/security/pssa-lint)",
    "Si el 4R arroja FAIL tier 2: STOP y escalar a judgment-day, nunca auto-fix (RDD rule 4)"
  ],
  "auto_fix": false,
  "retroactive": true,
  "retroactive_note": "Freeze point capturado pre-batch (base 8bd151a3) pero receipt redactado despues del ship. Documenta lo ocurrido sin maquillar la brecha.",
  "timestamp": "2026-09-22T21:55:57-06:00"
}